,tweet_id,datetime,tweet_text,polarity,sentiment,author_id,followers_count,retweet_count,like_count,collection_time,original_tweet_id
25,1455957951802347520,2021-11-03 14:00:00,It was great to sit down with for their latest podcast episode to chat about all things We covered our use of our DataForGood products to drive the AV and EV revolutions our upcoming combination with VOSO and our partnerships with PLTR amp MSFT,0.3814814814814815,positive,20601316,1223,1,10,2021-11-04 07:37:30,
24,1455957956839755779,2021-11-03 14:00:01,vxrt gme fsr sndl hood nakd riot rblx mrna pltr wish btbt fubo mara cei any spce sos bbig mvis any dwac dkng lcid amc coin sklz clov cei WE ALERTED OCGN at 30 RAN TO 3 900 GAIN DAILY ALERTS 15 ONE TIME FEE BEAT THAT LINK IN BIO,0.0,neutral,1345666465870061568,3655,0,3,2021-11-04 07:37:30,
19,1455958952236261376,2021-11-03 14:03:59,10 most mentioned US stocks on Reddit in past 24 hours 1 GME 211 2 TSLA 83 3 AMC 70 4 BB 62 5 BBBY 51 6 OCGN 41 7 SPY 33 8 CAR 29 9 PLTR 22 10 OWNS 16 stock trading usstock stockmarket,0.125,positive,1362285299523493894,2352,3,8,2021-11-04 07:37:30,
20,1455961488217329667,2021-11-03 14:14:03,6 months ago these geniuses lectures to me how Tesla has already ran up so high it doesn t have enough upside to invest in at 600 per share Hold my vodka and 100 gains,0.08,positive,294548572,,24,741,2021-11-04 07:37:30,
18,1455962279955030018,2021-11-03 14:17:12,They ll continue to say that all the way to 2k 3k 4k per share At this point Tesla is the safest position I m in Palantir in 5 years will be a similar story,0.0,neutral,100549778,518,0,1,2021-11-04 07:37:30,
2,1455967627050831873,2021-11-03 14:38:27,Google is making a major push to win the Pentagon s big cloud computing contract three years after employee protests stopped the company from taking on military work Scoop w,0.19062500000000002,positive,316154811,,125,202,2021-11-04 07:37:30,
11,1455969594426806273,2021-11-03 14:46:16,Trading Ideas PLTR weakly waving higher maybe earnings will catalyze FREE trade of week via,0.09166666666666667,positive,121158213,162615,2,1,2021-11-04 07:37:30,
9,1455972470599688199,2021-11-03 14:57:42,PLTR Lets Thank Cathie to give many people dip low 25s add opportunity with 800K share sold while we know she still have 33M shares ARKK ARKW,0.25,positive,279020836,7050,0,4,2021-11-04 07:37:30,
5,1455972540959047681,2021-11-03 14:57:59,It s Wednesday So that means it s time for some phpstan drupal development sponsored by I ve got some PHPStan 1 0 cleanup remaining and render array callback rule inspections to work on Join me on Twitch,0.0,neutral,8665962,2079,2,4,2021-11-04 07:37:30,
8,1455973062252322820,2021-11-03 15:00:03,BREAKING Three years after an employee revolt forced Google to abandon work on a Pentagon program that used artificial intelligence the company is aggressively pursuing a major contract to provide its technology to the military New York Times,-0.16022727272727272,negative,1247223374717296647,,87,140,2021-11-04 07:37:30,
4,1455973523713822724,2021-11-03 15:01:53,Which Company are you Most Excited for during Q3 Earnings Season,0.4375,positive,1163605918615035904,142295,0,29,2021-11-04 07:37:30,
6,1455974019346444293,2021-11-03 15:03:51,It looks like it wants to break out like TSLA did,0.2,positive,179086097,,0,3,2021-11-04 07:37:30,
14,1427976383783833607,2021-08-18 08:51:15,Palantir adds gold to its treasury and accepts it as payment It now holds gold startups SPACs and possibly Bitcoin as part of its corporate treasury They already accept BTC as payment Image rendering of Palantirs innovative new payment terminal,0.1590909090909091,positive,13418472,,114,1280,2021-11-04 07:37:29,
13,1427976386275209223,2021-08-18 08:51:15,Sauce,0.0,neutral,13418472,,30,300,2021-11-04 07:37:29,
29,1455220854439153671,2021-11-01 13:11:03,GIG GIGGW DD Thread Valuation GIG 1 6B competitor PLTR 50B Multiple contracts partnerships with amp Current Stock Price 9 99 long commons warrants and calls Q4 merger vote any day now,-0.016666666666666666,negative,840725668207943680,,15,40,2021-11-04 07:37:29,
19,1455687863924842504,2021-11-02 20:06:46,Krestu Jesu before you return your disciples want to know why you re bullish on Palantir,0.0,neutral,4763652143,,0,0,2021-11-04 07:37:29,
21,1455893833959477248,2021-11-03 09:45:13,In an AD environment Is there any reason why you wouldn t block incoming traffic on port 445 on every workstations if admin tasks are done using RDP,0.0,neutral,2677562396,,39,265,2021-11-04 07:37:29,
12,1455921102790688772,2021-11-03 11:33:35,PLTR Started purchasing my first ever stock on PLTR on 28 Oct 2021 Keep tracking maybe just in case one day I can tell someone my PLTR story,0.25,positive,983016571319730176,,1,4,2021-11-04 07:37:29,
36,1455963415688667145,2021-11-03 14:21:43,I think will be similar after 5 6Q s 2023 will be incredible for pltr,0.45,positive,1306690698637385734,,0,3,2021-11-04 07:37:29,
25,1455972021335216129,2021-11-03 14:55:55,ETHER HITS NEW RECORD HIGH OF 4 662 30,0.1481818181818182,positive,2704294333,,61,581,2021-11-04 07:37:29,
39,1455974521144479745,2021-11-03 15:05:51,PLTR of course Reminds me of the TSLA chart in the early days,0.1,positive,2321149288,,0,4,2021-11-04 07:37:29,
37,1455976875780571136,2021-11-03 15:15:12,SOFI is next,0.0,neutral,803109488563601409,,0,2,2021-11-04 07:37:29,
27,1455977704210280448,2021-11-03 15:18:30,Mine are SOFi HIMS BODY OPEN PLTR MVST PSFE CPNG LCID I will be focused purely on guidance for CPNG LCID s earnings conference call,0.10714285714285714,positive,1163605918615035904,,3,59,2021-11-04 07:37:29,
35,1455980088898457601,2021-11-03 15:27:58,I like this philosophy how many stocks are you holding,0.5,positive,1399126575350616064,,0,0,2021-11-04 07:37:29,
24,1455980901351915520,2021-11-03 15:31:12,i think pltr will finally trade 30 this time around now 26,0.0,neutral,1315455789721501697,10860,6,72,2021-11-04 07:37:29,
5,1455981034147770372,2021-11-03 15:31:44,PLTR going according to plan,0.0,neutral,1085712847256969216,303,2,7,2021-11-04 07:37:29,
20,1455981360028561408,2021-11-03 15:33:01,Would love to see this cup and handle play out for BBIG before the end of play AH PM Will do Looking good on the reversal though LFG,0.6,positive,3863963441,,2,15,2021-11-04 07:37:29,
34,1455982019712897028,2021-11-03 15:35:38,I absolutely loved how you articulated the expressiveness of DAG which is enabled by its tetrahedron data structure that is formed through tessellation amp its significance of behaving as a validated data oracle that forms a scalable hylochain of interoperable data,0.7,positive,1405692717838053376,597,2,15,2021-11-04 07:37:29,
10,1455982821919633413,2021-11-03 15:38:50,Please let me know so I can buy leaps I love Palantir but had to move my money to Tesla and Crypto Too high opportunity cost to stay in Palantir imho,0.33,positive,711229520444071937,92,0,0,2021-11-04 07:37:29,
23,1455984010488950788,2021-11-03 15:43:33,I would say Palantir has a analytical component which DAG could theoretically be enabled by a implementing a domain specific language to query data as a decentralized computational knowledge engine Near term I could see DAG feed validated data into Palantir for analysis,0.03333333333333333,positive,1405692717838053376,597,1,7,2021-11-04 07:37:29,
31,1455985522560569345,2021-11-03 15:49:34,Love the holdings Bunch of winners,0.5,positive,1399126575350616064,,0,1,2021-11-04 07:37:29,
30,1455987154845319186,2021-11-03 15:56:03,Congrats to for winning the OpenSource Giants award at AcquiaEngage as well as to the two finalists and Learn more about them here Drupal DigitalExperience,0.5,positive,14115745,3035,1,2,2021-11-04 07:37:29,
8,1455991237656334336,2021-11-03 16:12:16,FREE ALERTS Recap OSTK paid 155 UAL paid 75 CCL paid 35 amp 30 Likes for Tomorrow Picks SPY TSLA SHOP AMZN ROKU NFLX BYND LCID PLTR COIN HOOD MARA AMD NVDA AAPL BA QCOM MRNA PFE NVAX SPOT MSFT NIO NVAX SPX NET BITO CAR PG,0.2,positive,341223258,3884,8,36,2021-11-04 07:37:29,
17,1455996431718825987,2021-11-03 16:32:55,Highlights Earth Intelligence Business Segment 2020 Revenue by Customer Type MAXR U S Govt and Agencies 64 International Defense amp Intelligence 15 Commercial Customers 13 GOOGL AMZN PLTR UBER GM LMT,0.0,neutral,1032431379211083776,381,2,4,2021-11-04 07:37:29,
11,1455996504796192770,2021-11-03 16:33:12,Palantir is technically over 400 and growing software products in 1 company They also almost have no comparable competition in each category their in E g what takes competitors 6 months to do Palantir can do it in week or less Also There is a huge information asymmetry,0.0777777777777778,positive,1004129134463934464,1326,0,1,2021-11-04 07:37:29,
3,1455996510726864896,2021-11-03 16:33:13,PLTR Anyone else see this earlier RBC Analyst said their Q3 deal volume was messed up due to a typo in the public data Screams incompetence on someone s end but I m gonna dig a little and see what I can find,-0.078125,negative,1352081695101472769,241,0,27,2021-11-04 07:37:29,
9,1455997873397579790,2021-11-03 16:38:38,That book looks good I have been out to Google HQ The building right next door is the Army pyscological warfare building Coincidence,0.32857142857142857,positive,496000129,,0,0,2021-11-04 07:37:29,
1,1456000780813676550,2021-11-03 16:50:11,Fair And I m building position in all 3 My thoughts are that Tesla will have a slower time to 10T than PLTR will to 1T I e 20x vs 10x in probably half the time we ll see obvi not investment advice Palantir is a long term horizon for sure,0.24583333333333335,positive,100549778,518,0,0,2021-11-04 07:37:29,
6,1456001095331811331,2021-11-03 16:51:26,This is the contract I do not see any meaningful impact really,0.35,positive,898532053,1436,0,8,2021-11-04 07:37:29,
0,1456001917545377792,2021-11-03 16:54:43,Yes I saw this too It s note even awarded to PLTR but to Sava Workforce Solutions lol Definitely a typo though as the description says it s for 3 field representatives so it s probably labor costs which would definitely be 164k I reckon,0.26666666666666666,positive,1352081695101472769,241,0,5,2021-11-04 07:37:29,
4,1456002604509532162,2021-11-03 16:57:26,FDX 19 profit so far No change to position Bull flagging in the gap Close over 241 and we can gap fill real fast High conviction in this one Will add more over 241 probably,0.265,positive,4787170800,259,0,0,2021-11-04 07:37:29,
2,1456002642648264704,2021-11-03 16:57:35,PLTR 1 Alright I m no expert here so please correct me if I m wrong but I think I found what the analyst might be referring to it s the only value I found in the entire FPDS system USA spending that I reckon the analyst could be referring to,-0.16666666666666666,negative,1352081695101472769,241,0,8,2021-11-04 07:37:29,
42,1402576378948505601,2021-06-09 06:40:42,See this interesting though utterly unrealistic promo clip postulating a single Chinese PLAN destroyer attempting to enforce a blockade of Taiwan s Kaohsiung port and how US coming in to save the day with the help of Palantir app,-0.017857142857142856,negative,736279751036264448,,2,6,2021-11-04 07:37:28,
45,1402596672429981699,2021-06-09 08:01:20,Palantir s Gotham defense decision making system simulates a scenario where PLA attacks Kaohsiung Taiwan,0.0,neutral,2888593734,,8,7,2021-11-04 07:37:28,
41,1441521345708412928,2021-09-24 17:54:05,The next FB AAPL AMZN NFLX GOOG Is among a new class of growth names OPEN DNA ROKU TDOC LMND SKLZ DOCU PTON AFRM PLTR S BROS PINS UPST SNAP SE Which of these do you like What s missing,-0.015909090909090914,negative,1249856199597658118,,79,547,2021-11-04 07:37:28,
24,1455908910251089927,2021-11-03 10:45:08,Cathie Wood s ARK Invest Sells Nearly 850 000 More Shares of Palantir PLTR ARKW,0.3,positive,17622474,,0,0,2021-11-04 07:37:28,
44,1455934593039618055,2021-11-03 12:27:11,Love it This is our top insureTech name 4 5bn current market cap seems very attractive relative to TAM LMND Could take years to play out This is not investment advice,0.4,positive,45967905,,7,73,2021-11-04 07:37:28,
47,1455938718242689029,2021-11-03 12:43:35,Wow Biden admin blacklists Israeli spyware firm NSO Group after finding its Pegasus phone hacking tool was used to maliciously target activists journalists and govt workers,-0.05,negative,1634248890,,125,887,2021-11-04 07:37:28,
9,1455968043776057344,2021-11-03 14:40:06,An absolutely futuristic experiment,0.2,positive,817374344301211648,,0,3,2021-11-04 07:37:28,
1,1455978987050524673,2021-11-03 15:23:35,when someone not as terminally online as you sends you a meme,-0.4,negative,14105981,,61,744,2021-11-04 07:37:28,
39,1455985371460747265,2021-11-03 15:48:58,Tradez You bet you,0.0,neutral,1437584476859666432,,0,0,2021-11-04 07:37:28,
0,1455986082273710085,2021-11-03 15:51:47,What s your position on pltr at this point Still Long,-0.05,negative,1272936703704076288,,0,0,2021-11-04 07:37:28,
26,1455986596742934534,2021-11-03 15:53:50,TODAYS Recap FUTU calls paid over 90 UAL calls paid 75 FSR calls paid 50 SPY puts paid 15 One Red trade on SNAP SPY TSLA SHOP AMZN ROKU NFLX BYND LCID PLTR COIN HOOD MARA,0.0,neutral,341223258,,1,12,2021-11-04 07:37:28,
48,1455993182152499204,2021-11-03 16:20:00,Managing risk is the most crucial trait of a successful trader Most traders fail because they can t manage risk properly AAPL AMD AMZN BA FB MSFT NIO NVDA PLTR ROKU SNAP SPCE SPX SPY SQ TSLA ZM NET GME SNOW,0.17857142857142858,positive,1440420111425310722,,1,0,2021-11-04 07:37:28,
37,1455998624773644294,2021-11-03 16:41:37,This earnings season is exhausting Tomorrow another crazy day SQ I m heavily in Will add on a dip which I think will occur Now I have to rest This CoVID is pain Was ok and now sick again,-0.2828571428571428,negative,1012372291513208832,,0,22,2021-11-04 07:37:28,
3,1455999279177273356,2021-11-03 16:44:13,sklz same Type of earning like summer I am not saying that will happen To dm sofi or any other despac again but I won t hold them thru earning not worth the risk lc upst IPO,-0.09166666666666667,negative,279020836,,0,9,2021-11-04 07:37:28,
43,1455999797509296130,2021-11-03 16:46:17,cathy wood probably going to sell all her pltr now to buy dips,0.0,neutral,1126196458699481088,,0,1,2021-11-04 07:37:28,
30,1456000509454716928,2021-11-03 16:49:07,If you re in my discord congrats if you got in one of these momo plays Always a bonus when you can hit pt amp grab your bag on the same day CVS PLTR AMD SOFI CLOV F WMT NKE AAL XLE,0.0,neutral,24947901,,1,13,2021-11-04 07:37:28,
36,1456002965139955712,2021-11-03 16:58:52,The company listed in the contract is providing help desk services for Palantir s software I d like to talk to someone at RBC Capital From the contract description Adds up to 3 Field Service Representatives additional for Help Desk Services for Palantir Soft,0.1,positive,898532053,1436,0,4,2021-11-04 07:37:28,
49,1456003009519968259,2021-11-03 16:59:03,What stock surprised you today,0.1,positive,817007725666242561,,5,79,2021-11-04 07:37:28,
46,1456004809056657408,2021-11-03 17:06:12,They were correct in identifying the error but thats about it Their expectations are inline with consensus which is based on management guidance of 385M in Q3 revenue I doubt they revised anything they modeled internally,0.0,neutral,898532053,1436,0,3,2021-11-04 07:37:28,
34,1456005011545092097,2021-11-03 17:07:00,ESG is a driving force in everything we do and our teams are driving towards dozens of deliverables including the first EV SUV to have a full cradle to cradle carbon lifecycle analysis including end of life FiskerEarningsCall,0.3,positive,1031648001251368960,,7,65,2021-11-04 07:37:28,
31,1456007011829694468,2021-11-03 17:14:57,PLTR Buy What She Sells As It Always Goes UP,0.0,neutral,974356156452950016,469,1,1,2021-11-04 07:37:28,
33,1456009359440314368,2021-11-03 17:24:17,FWSells PLTR Moore Alexander D Director of Palantir Technologies Inc sold 34 000 shares on 2021 11 01,0.0,neutral,1262915121103491074,768,1,0,2021-11-04 07:37:28,
32,1456009385449193474,2021-11-03 17:24:23,FWSells PLTR Glazer David A of Palantir Technologies Inc sold 9 000 shares on 2021 10 29,0.0,neutral,1262915121103491074,768,1,0,2021-11-04 07:37:28,
38,1456010740779950080,2021-11-03 17:29:46,PYPL tomorrow Book it now Great daily candle and move into close,0.4,positive,1114443000082464768,,0,24,2021-11-04 07:37:28,
10,1456010924075196423,2021-11-03 17:30:30,mcadams Watch Pltr tomorrow as well interesting set up,0.5,positive,3038400878,52,1,1,2021-11-04 07:37:28,
35,1456011111472435207,2021-11-03 17:31:15,893 860 00 of shares sold by Moore Alexander D Director reported in a new form 4 filed with the SEC PLTR,0.018181818181818174,positive,1134049078424162304,19392,0,0,2021-11-04 07:37:28,
11,1456011802140098565,2021-11-03 17:33:59,Next week s earning will be crazier lol fubo grwg nio pltr,0.4,positive,43750179,108,1,3,2021-11-04 07:37:28,
12,1456012056205791235,2021-11-03 17:35:00,Our members secured 19 44 profit on SAVA today providing live analysis and alerts throughout the trade ADBE PLTR AMZN SHOP MRNA NOK OXY GNUS KNDI KTOV TSLA NIO SPY V,0.13636363636363635,positive,1353211811638751234,638,0,0,2021-11-04 07:37:28,
25,1456012184400678916,2021-11-03 17:35:30,So they could have booked it as 164m by mistake,0.0,neutral,1374129841646272515,189,0,0,2021-11-04 07:37:28,
13,1456012232169558019,2021-11-03 17:35:42,What s the chance that Palentir PLTR uses this software,0.0,neutral,15999694,195,0,0,2021-11-04 07:37:28,
14,1456013251309867009,2021-11-03 17:39:45,PLTR DD Bullish pendant Earning soon with four prior earnings beats,0.0,neutral,2498429597,99,0,1,2021-11-04 07:37:28,
15,1456014551464517638,2021-11-03 17:44:55,That s the problem with pltr The insiders keeps selling No faith in the company,0.0,neutral,501080578,234,1,1,2021-11-04 07:37:28,
16,1456014804875948038,2021-11-03 17:45:55,PLTR Foundry for 3C Carbon Cradle to Cradle Neutrality,0.0,neutral,1117013235050455040,17,1,0,2021-11-04 07:37:28,
17,1456016477178327040,2021-11-03 17:52:34,My PF 1 77 ASXC After Best SOXL TSLA 3 57 ATH Worst GE 0 67 My PF TSLA CCL GE RPRX ASXC AMRS PLTR ZI XLK SOXL AR,0.0,neutral,64711495,,0,1,2021-11-04 07:37:28,
27,1456017538563940352,2021-11-03 17:56:47,i doubt they d sell off when there are two scheduled launches this month No,0.0,neutral,69082119,12351,0,0,2021-11-04 07:37:28,
23,1456017972892512257,2021-11-03 17:58:30,bal egld pltr sc avax aapl orn poly fet snt bsc uni itrm ong news doge keep cryptotrading oott xlm nkn btcb powr xl nexo nfi rose audio hot comp ht mir juv xch bmon ddtg wallstreetbets dawgs amzn ren cream ksp luna rvn ont vtho,0.425,positive,17573668,1034,1,0,2021-11-04 07:37:28,
18,1456018349234688001,2021-11-03 18:00:00,Today s Top Bullish Flow AMD FB AAPL BBWI PLTR FUTU options stockmarket wallstreet nasdaq nyse fintech blackbox,0.5,positive,1261715983716229122,5371,0,2,2021-11-04 07:37:28,
19,1456018654458368003,2021-11-03 18:01:13,FinalTrade Buy PLTR into the Earnings,0.0,neutral,807161508635365377,878,0,4,2021-11-04 07:37:28,
21,1456019236149727245,2021-11-03 18:03:32,So many incompetent analysts about as well,0.07500000000000001,positive,1374129841646272515,189,0,2,2021-11-04 07:37:28,
6,1456020050918318082,2021-11-03 18:06:46,Batteries exploding in the middle of an intersection is down right dangerous A trillion dollar company can t be making cars like this You don t see Apple phones exploding tsla tslaq LCID aapl,-0.11746031746031746,negative,1338872866171809794,,5,20,2021-11-04 07:37:28,
20,1456020433493397508,2021-11-03 18:08:17,2021 11 04 07 00 PLTR UPST ABNB DOCS UPST DLO PLTR SNOW COUR DDOG ABNB MQ DOCN,0.0,neutral,1262699778070032384,,0,10,2021-11-04 07:37:28,
5,1456026183905288194,2021-11-03 18:31:08,Long twlo Communication u meta pltr tracking docn Storage mq transaction gtlb collaboration okta identity cflt Motion shop purchase glbe birder logistic dlo cross border roku stream pins discovery dkng Gambling mtch interact coin cryptoplace fb social,-0.005555555555555557,negative,1242826489,8094,3,32,2021-11-04 07:37:28,
4,1456027248453107723,2021-11-03 18:35:22,PLTR 24 5 key levels to hold for bulls I am bullish above it,0.0,neutral,1128481490923184128,11031,13,118,2021-11-04 07:37:28,
2,1456028053197500423,2021-11-03 18:38:34,Earnings Preview Palantir Technologies Inc PLTR Q3 Earnings Expected to Decline,-0.1,negative,398263783,52056,1,1,2021-11-04 07:37:28,
34,1430992221713612802,2021-08-26 16:35:06,Palantir PLTR invested 25M in Faraday Future FFIE shortly before the EV startup became a public company in July In addition Faraday Future signed a commercial contract to use Palantir s software,0.0,neutral,1250830691824283648,,17,105,2021-11-04 07:37:27,
33,1431961087218384897,2021-08-29 08:45:02,A Deep Dive on PLTR Palantir build the digital infrastructure for data driven operations and decision making PLTR seeks to become the next industry default software In this thread I will go over the things that you need to know about PLTR Let s get started,0.0,neutral,3000746617,,256,1271,2021-11-04 07:37:27,
35,1432450242574696453,2021-08-30 17:08:46,Palantir PLTR today was awarded a 48 5M modification to a previous contract with the US Air Force to provide a term software licenses cloud hosting enablement services support and training for each platform The total cumulative face value of the contract is 91 5M,-0.08333333333333333,negative,1250830691824283648,,40,302,2021-11-04 07:37:27,
38,1433050316497358852,2021-09-01 08:53:14,BlackSky Secures Investment from Palantir and Enters into Multi Year Strategic Partnership Following Successful Pilot Project PLTR,0.375,positive,1250830691824283648,,13,82,2021-11-04 07:37:27,
24,1434076699008778240,2021-09-04 04:51:43,ETH been on fire lately But please everyone if you are invested in crypto know the upside and the downside Know what you are in beside all the hype,-0.3,negative,3000746617,,0,7,2021-11-04 07:37:27,
36,1445486538251374592,2021-10-05 16:30:21,PLTR secures 823 million contract from US Army for intelligence data fabric and analytics,0.0,neutral,817007725666242561,,141,925,2021-11-04 07:37:27,
37,1446106090253557770,2021-10-07 09:32:13,PLTR Wins New 90M contract,0.21818181818181817,positive,294548572,,53,524,2021-11-04 07:37:27,
25,1451983013051576326,2021-10-23 14:45:01,Great to have you crystallize those hands,0.8,positive,1081004780804366336,,0,2,2021-11-04 07:37:27,
7,1452252311716339718,2021-10-24 08:35:07,next month i will create vip room at telegram with subscription if u want to have discount hit like and u will get the code later es f spy es f nq zm amzn spx vix fubo pltr,0.0,neutral,756036164,2614,6,224,2021-11-04 07:37:27,
44,1453841660610289667,2021-10-28 17:50:37,PLTR The largest Ponzi Scheme conviction in history 2008 worth about 64 8 billion Courtesy of Palantir Tech,0.3,positive,1356214197009457157,,56,360,2021-11-04 07:37:27,
43,1455300642986147842,2021-11-01 18:28:06,PLTR Patiently waiting on this name to complete this leading diagonal Any failure around 30 will give this stock a whole new look,0.029924242424242416,positive,67776207,,4,18,2021-11-04 07:37:27,
10,1455617081886576654,2021-11-02 15:25:31,I just wrote a letter Write letter to regarding amp their provision of predictive artificial intelligence provided to Israeli military Write one here,-0.35,negative,51184630,,1,0,2021-11-04 07:37:27,
14,1455618843200663555,2021-11-02 15:32:30,I just wrote a letter Write letter to regarding amp their provision of predictive artificial intelligence provided to Israeli military Write one here,-0.35,negative,390949150,,1,0,2021-11-04 07:37:27,
0,1455731440373714945,2021-11-02 22:59:56,Seriously i dont get it lol,0.23333333333333336,positive,1432883190050525185,,0,0,2021-11-04 07:37:27,
20,1455800444505178112,2021-11-03 03:34:08,Yup even the moon,0.0,neutral,44196397,,25928,305546,2021-11-04 07:37:27,
23,1455822368459345922,2021-11-03 05:01:15,In search for Technology that improves productivity Artificial Intelligence etc Any companies you know of give me a shout,-0.6,negative,1055574882392649728,,0,0,2021-11-04 07:37:27,
22,1455925617938022415,2021-11-03 11:51:31,Check it out Lilium told us they re leveraging their data analytics platform with to help tighten the testing feedback loop,0.0,neutral,1117823080968142848,,25,121,2021-11-04 07:37:27,
41,1455949987594977282,2021-11-03 13:28:21,Do you know why Biden appointed Avril Haines to an Intelligence position and why her employement at Palantir which she included in resumes appears to have been recently erased from Google resume etc Who is she,0.0,neutral,1118971779064553472,,1,1,2021-11-04 07:37:27,
1,1455951975590371332,2021-11-03 13:36:15,Thats cuz cathie doesnt invest smart she invests for the long term she seems to think those things are mutually exclusive,0.08214285714285713,positive,1220180219383906306,,0,0,2021-11-04 07:37:27,
46,1455989315738210309,2021-11-03 16:04:38,ziel sqqq will rebound hard as the nasdaq is severely overbought on THE FED INDUCED PONZI,-0.2916666666666667,negative,1328509389695832065,,0,2,2021-11-04 07:37:27,
11,1455994637135589386,2021-11-03 16:25:47,Palantir had a really nice blog on this,0.6,positive,2760268429,,1,35,2021-11-04 07:37:27,
42,1456021741478682624,2021-11-03 18:13:29,pltr to 29 this results Got a bit up their sleeve,0.0,neutral,3184815738,,1,5,2021-11-04 07:37:27,
40,1456023677326266373,2021-11-03 18:21:10,Shameless plug Ya ll know where ideas are shared SBUX NKE XOM SNAP PLTR,0.0,neutral,1351756792800415744,,2,7,2021-11-04 07:37:27,
45,1456028330348658690,2021-11-03 18:39:40,How about pltr,0.0,neutral,2816179435,,0,0,2021-11-04 07:37:27,
28,1456033451040288775,2021-11-03 19:00:01,We re a global leader in our space backed by leaders in their respective areas incl amp Why Because they believe in our vision to use DataForGood amp to make mobility cleaner safer amp more efficient Find out more wejourney MSFT PLTR GM,0.25,positive,2863741665,4145,2,9,2021-11-04 07:37:27,
