,tweet_id,datetime,tweet_text,polarity,sentiment,author_id,followers_count,retweet_count,like_count,collection_time,original_tweet_id
26,1456038294773542913,2021-11-03 19:19:16,Trades so far this week via Discord DKNG calls W calls very big ROI DOCU calls PLTR calls although one member held and made some off of it FVRR calls SQ calls ESGD puts holding right now at about even YUM calls alerted at close,0.12857142857142856,positive,1364000880408805377,3,1,1,2021-11-04 07:37:27,
13,1456043786862092296,2021-11-03 19:41:05,Looks like we will have flying cars after all Excited about Palantir s work with,0.375,positive,1325969408397729792,918,3,46,2021-11-04 07:37:27,
3,1456043815635128330,2021-11-03 19:41:12,Do you think in your lifetime you will ever see a stk like Tsla again Ship people on my room Lots of them have 5 10 25 50m in just tsja stk people bought 2 3 4K shares at 200 Now is 10 15 20k shares I tell em to write 1400 fir this week at 5 bank 100k,0.0,neutral,64888916,,7,98,2021-11-04 07:37:27,
18,1456045713209630721,2021-11-03 19:48:44,Almost there with Saruman now just need to finish the other arm and staff do a little tidying up and then the palantir and base The end is in sight WarhammerCommunity Warmongers LOTR mesbg,-0.37083333333333335,negative,84810744,813,26,257,2021-11-04 07:37:27,
16,1456048747448766467,2021-11-03 20:00:48,What stocks are you watching tomorrow,0.0,neutral,817007725666242561,,15,167,2021-11-04 07:37:27,
9,1456049538393903116,2021-11-03 20:03:56,10 most mentioned US stocks on Reddit in past 24 hours 1 GME 192 2 TSLA 87 3 SPY 76 4 BB 63 5 AMC 49 6 OCGN 37 7 BBBY 28 8 AMD 21 9 PLTR 18 10 MSFT 17 stock trading usstock stockmarket,0.125,positive,1362285299523493894,2352,3,4,2021-11-04 07:37:27,
8,1456052977156960261,2021-11-03 20:17:36,puru Any thoughts on PTLR,0.0,neutral,1292217553125875718,3,0,0,2021-11-04 07:37:27,
5,1456055325325348867,2021-11-03 20:26:56,There s a lotta Pippin hate in the stratosphere but I stan loyal Firstly Pippin is a catalyst he was meant to touch the skeleton which awoke the Balrog In which case Gandalf was meant to become the white wizard and help turn the tide of the war,-0.05416666666666668,negative,1421321787518832640,27,0,1,2021-11-04 07:37:27,
17,1399440414466314240,2021-05-31 14:59:29,I believe PLTR will eventually be one of the biggest companies in the world,0.0,neutral,102869127,,129,1459,2021-11-04 07:37:25,
16,1447578090515750916,2021-10-11 11:01:26,A quick reminder that anything is possible NAKD SNDL PLTR SPCE CEI TSLA AMC GME,0.16666666666666666,positive,1440528607688810500,,11,88,2021-11-04 07:37:25,
6,1454177292108898307,2021-10-29 16:04:18,Palantir s Foundry for Crypto offers cutting edge technology for next generation finance Secure your exchange without losing your advantage Get started,-0.024999999999999994,negative,37959591,,98,545,2021-11-04 07:37:25,
7,1454199975727046662,2021-10-29 17:34:26,Appreciate highlighting Palantir s program for startups and growth companies Foundry for Builders,0.0,neutral,946187665812148225,,41,246,2021-11-04 07:37:25,
34,1454211557274132485,2021-10-29 18:20:27,I just found out that cash app has a feature where you can pick how you send the money For example you can send 100 as cash bitcoin or STOCK And you can pick the stock to send as well Can t believe I didn t know this existed Genius CashAppTreats PLTR,0.0,neutral,2984683240,,1,5,2021-11-04 07:37:25,
29,1455220968180305924,2021-11-01 13:11:30,PLTR adding to position and buying feb 18 28 calls Trading room link below,0.0,neutral,943094291823460357,,2,1,2021-11-04 07:37:25,
33,1455610074647252999,2021-11-02 14:57:40,I just wrote a letter Write letter to regarding amp their provision of predictive artificial intelligence provided to Israeli military Write one here cdnpoli vanpoli bcpoli,-0.35,negative,238446507,,1,1,2021-11-04 07:37:25,
12,1455760591818305536,2021-11-03 00:55:46,PLTR just back testing getting ready for another move up IMO Break 26 level then 29 next,0.06666666666666667,positive,1413697997343445001,1480,0,23,2021-11-04 07:37:25,
8,1455871228540035073,2021-11-03 08:15:24,PLTR Trying to push through resistance this week Constructive as holding above anchored vwap Above 27 gt crosses above descending trendline,0.0,neutral,899151164473790464,,1,2,2021-11-04 07:37:25,
21,1455878850903224327,2021-11-03 08:45:41,I ve lost count of how many people have fallen depressed since they ve made it in crypto,0.5,positive,712457848874086400,,151,2259,2021-11-04 07:37:25,
13,1455917296535232518,2021-11-03 11:18:27,WATCHLIST RECAP SNAP 52 21 54 11 calls 60 CVM 11 61 12 81 calls 50 OCGN 10 60 16 28 calls 150 TSLA 1115 1200 SPY 459 461 MRAI TBD PLTR 25 88 26 11 AAPL 149 80 150 The week isn t over Humbled amp Blessed We move on,0.0,neutral,3365643792,242,1,0,2021-11-04 07:37:25,
28,1456055898225381379,2021-11-03 20:29:13,Today in the discord I think w is my new avgo I ll play the same ticker every day idc dks w sdc pltr nflx nkla penn blnk rblx bgfv,0.06818181818181818,positive,1414721296483721217,,1,14,2021-11-04 07:37:25,
30,1456060647502929927,2021-11-03 20:48:05,PTON earning fails are the highlight of the season for me,-0.5,negative,723330373262925825,,0,1,2021-11-04 07:37:25,
26,1456066091222978565,2021-11-03 21:09:43,I got my 4 biggest holdings in the right order in terms of gainz TSLA BTC ETH PLTR,0.2857142857142857,positive,65149450,680,1,13,2021-11-04 07:37:25,
31,1456066342461734914,2021-11-03 21:10:43,OCGN HaHaahahahahahahahahhahah The Troll Farm Robos leave that part out the CEO sold yet he lpurchased the same amount of shares The CEO has a automated sale set just like PLTR TESLA just like most companys OCGN Bullish,0.25,positive,1404113094373122049,103,1,2,2021-11-04 07:37:25,
32,1456066414276747264,2021-11-03 21:11:00,Nellie Bowles comes from one of the foremost agricultural dynasties in California building their fortune off byzantine water rights laws amp cheap labor in a drought plagued state Her fiancee is rich race hustler Bari Weiss Couple of big unifiers right there Populism FTW,0.26517857142857143,positive,221299137,3922,0,5,2021-11-04 07:37:25,
27,1456066946105962496,2021-11-03 21:13:07,Here s something to watch A new non profit called Uatx was registered in July The directors include Bari Weiss Former AEI President Arthur Brooks Neocon amp Hoover Institute Fellow Niall Ferguson Palantir Tech Founder Joe Lonsdale,0.06818181818181818,positive,221299137,3922,1,4,2021-11-04 07:37:25,
18,1456073321771061248,2021-11-03 21:38:27,Please institutional funds I beg you Bring the market down I don t want to buy up here I don t want to be this I beg you,-0.15555555555555559,negative,3266165605,,2,126,2021-11-04 07:37:25,
25,1456073815507746816,2021-11-03 21:40:24,Can always do both or eventually sell of growth stocks for divy income when its needed I like a mix of both,0.0,neutral,171498390,,0,2,2021-11-04 07:37:25,
23,1456075771370475523,2021-11-03 21:48:11,DONT FOLLOW CATHIE WOODS BLINDLY SHE BOUGHT 290K SHARES OF Z YESTERDAY AND TODAY SHE DUMPED 2 9 MILLION SHARES OF Z ZILLOW SHE SOLD Z FOR AROUND A 50 LOSS AS SHE WAS BUYING THEM AT 150,-0.5,negative,109813243,,28,311,2021-11-04 07:37:25,
1,1456080617989361664,2021-11-03 22:07:26,PLTR So Dont follow Cathie with Blind SHE BOUGHT 290K SHARES OF Z YESTERDAY AND TODAY SHE DUMPED 2 9 MILLION SHARES OF Z Also told you take profit sklz at 12 90 or 13s Ah,-0.5,negative,279020836,7050,0,15,2021-11-04 07:37:25,
19,1456081043962966018,2021-11-03 22:09:08,I like Pltr though earnings I m holding with a cushion,0.0,neutral,826957558850150401,257,0,3,2021-11-04 07:37:25,
20,1456081332262612993,2021-11-03 22:10:16,She sold Pltr yesterday that why I said don t follow her sell I like Pltr,0.0,neutral,279020836,7050,0,0,2021-11-04 07:37:25,
10,1456085586591297536,2021-11-03 22:27:11,any thoughts on PLTR Earnings coming up on the 9th,0.0,neutral,1363853543094935561,4,0,1,2021-11-04 07:37:25,
5,1456093945524473859,2021-11-03 23:00:24,PLTR PLTR Getting tight,-0.17857142857142858,negative,887754279125221378,120436,18,274,2021-11-04 07:37:25,
4,1456096809198096394,2021-11-03 23:11:46,3 4 As this has occurred Karp has been diluting the share count creating sell pressure and impacting SBC in the company financials This selling pressure cannot prolong past Dec 3rd 2021 Once all the warrants are executed I believe Karp will quit his selling frenzy,-0.125,negative,1347253975519645696,422,0,0,2021-11-04 07:37:25,
3,1456097705697026049,2021-11-03 23:15:20,J Most of these stocks aren t in IWM They didn t get introduced until June,0.5,positive,3465982094,86,0,0,2021-11-04 07:37:25,
2,1456098396549353475,2021-11-03 23:18:05,83 J pltr for example isn t a small cap stock and peaked the too It s all about risk on risk off Just my opinion good luck,0.22499999999999998,positive,2744030495,75,1,2,2021-11-04 07:37:25,
0,1456099483834466306,2021-11-03 23:22:24,PLUG Block Deals FCEL Block Deals PLTR Block Deals LCID Block Deals F Block Deals SNDL Block Deals,0.0,neutral,1398562566603898882,15774,1,2,2021-11-04 07:37:25,
21,1352187517123112963,2021-01-21 04:33:21,The idea was do not let anyone know we exist,0.0,neutral,1344951,,35,114,2021-11-04 07:37:23,
37,1433414616265248770,2021-09-02 09:00:50,My longest and most insightful deep dive yet here s PLTR Demystifying the World s Most Secretive Company,0.3333333333333333,positive,1446147116,,129,619,2021-11-04 07:37:23,
20,1452856498573352961,2021-10-26 00:35:56,PLTR Weekly PLTR still holding this trend line,0.0,neutral,1208467461521043456,17462,6,35,2021-11-04 07:37:23,
17,1453680828530270212,2021-10-28 07:11:32,I feel like you re implying that many positions are important when in fact they re not The reality is that most jobs outside of infrastructure medicine etc are not important Doctors taking 6 months off is a problem Palantir CEO No one in the world would even notice,0.24,positive,492018402,,11,258,2021-11-04 07:37:23,
6,1454464611286147076,2021-10-30 11:06:00,Hope this isnt taken as boastful but im just so happy my PLTR article has been read by so many just crossed the 20k view mark Has motivated me to keep at this journey of writing and sharing my analysis Thank u to those that read promoted reacted 2,0.65,positive,1159118682477477889,,21,172,2021-11-04 07:37:23,
11,1455928287633494024,2021-11-03 12:02:08,Make digital ID required for all monetary transactions and all travel This enables government to shut you off EVIL,-0.5,negative,913469806598291456,,3,46,2021-11-04 07:37:23,
28,1455934573301354499,2021-11-03 12:27:06,Excited to see VA choose an optimist vision of the future and reject divisive demonizing and angry rhetoric being fed to our children by neo Marxists Time to take back our institutions to reflect the open minded liberal pro freedom values upon which our nation was founded,-0.025,negative,134321104,,12,208,2021-11-04 07:37:23,
45,1455947039431270405,2021-11-03 13:16:39,I rarely buy things at or close to the IPO These were my entry cost bases on popular IPOs from the last year or so SNOW 233 COIN 245 MTTR 13 ABNB 138 U 92 Patiently waited for drops and bases to make them full positions Discipline pays off,0.3125,positive,85663573,,13,341,2021-11-04 07:37:23,
12,1455987964895371266,2021-11-03 15:59:16,AMC Tried again today pull back May run AH,0.0,neutral,21764428,,5,51,2021-11-04 07:37:23,
16,1455996816751616004,2021-11-03 16:34:26,ROKU are you smiling QCOM are you smiling FSR are you smiling,0.0,neutral,345525945,,1,122,2021-11-04 07:37:23,
46,1456015768462626818,2021-11-03 17:49:45,This palantir is screaming at me and I cant tell if its foresight or subterfuge LOTRonPrime,0.0,neutral,61524920,,1,43,2021-11-04 07:37:23,
49,1456026849809735689,2021-11-03 18:33:47,The list of names I am interested in owning is rapidly shrinking Not just individual names but entire sectors look unappealing In lots of cash so time to widen the horizon maybe Buy me a jpig or one of them thar NTF s Hoping for a turn and character change,-0.037500000000000006,negative,1232525106003365890,,1,30,2021-11-04 07:37:23,
29,1456054895115706377,2021-11-03 20:25:13,PLTR These incompetent analyst mistakes costs retail traders to lose lot of money and that s how easily BIG funds manipulating stock price in free market Why don t they do mistake proofing before publishing Not me but many small investors or beginners rely on their rating,0.06000000000000001,positive,1387159015457796097,,1,4,2021-11-04 07:37:23,
9,1456076229006659587,2021-11-03 21:50:00,mara fsr tsla bbig gme fb aapl riot sndl nio coin msft wkhs pltr amd sos dkng mvis nakd btbt fubo amc penn dwac any zom spy clov cei WE ALERTED PHUN at 1 50 RAN TO 24 1500 GAIN DAILY ALERTS 15 ONE TIME FEE BEAT THAT LINK IN BIO,0.0,neutral,1345666465870061568,3655,1,2,2021-11-04 07:37:23,
26,1456084314299510785,2021-11-03 22:22:07,That s what I was thinking If it can hit 30 before earnings I may walk away,0.0,neutral,826957558850150401,,0,0,2021-11-04 07:37:23,
5,1456087359997595651,2021-11-03 22:34:14,How should we build an ethical society without destroying ourselves using AI,0.0,neutral,1317820212691963905,,0,6,2021-11-04 07:37:23,
38,1456088832055590913,2021-11-03 22:40:05,PLTR Has to be one of my favorite stocks looks like some sort of pennant forming on the daily chart Having trouble breaking and holding the trendline IMO if we can break and hold over 26 74 we can see a move to 27 50 gt 28 79 to potentially fill the gap at 30,0.075,positive,1420921024833638401,,1,1,2021-11-04 07:37:23,
39,1456093491604426755,2021-11-03 22:58:35,Would y all hold pltr idk anymore,0.0,neutral,419230916,,1,1,2021-11-04 07:37:23,
40,1456097743081033728,2021-11-03 23:15:29,PLTR daily earnings Tues morning before market open,0.0,neutral,222872999,,1,4,2021-11-04 07:37:23,
30,1456100126552899595,2021-11-03 23:24:57,Moving my podcast DOMinating Your Investments to owned by to provide more engagement with followers polls amp outlets to listen to episodes PLTR investors I have episodes with,0.5,positive,1079017963968172034,,2,9,2021-11-04 07:37:23,
1,1456102431079772161,2021-11-03 23:34:07,x KD Watchlist FCX SOFI NETE QCOM FUBO MYNZ GT DISCA PLTR NVDA AMD Featuring uhmillion,0.0,neutral,1345825326950187015,6448,4,13,2021-11-04 07:37:23,
47,1456102857938198536,2021-11-03 23:35:49,benadryl subreddit is a very cursed concept,0.2,positive,375948237,,0,3,2021-11-04 07:37:23,
22,1456105607165972488,2021-11-03 23:46:44,Maybe the verdict had considered that no one was brave enough to speak up and tell us all how brutally flawed these drone strike programs were Surely the gov t would ve listened to amp celebrated such a man and maybe those kids would still be alive today Oh wait hang on a sec,0.14375,positive,110183325,,18,92,2021-11-04 07:37:23,
42,1456106884247736323,2021-11-03 23:51:49,J PLTR needs a beat and raise Question is really whether the large investment in the salesforce is paying off already or deals are taking longer to sign We won t know until earnings as Palantir doesn t issue press releases for each of their deals,0.20714285714285713,positive,1062074042969137152,2575,1,0,2021-11-04 07:37:23,
44,1456107820047220739,2021-11-03 23:55:32,We will see 1 this month I guarantee you METX it ll be life changing,0.0,neutral,1453210493187809281,,0,5,2021-11-04 07:37:23,
25,1456108185023094786,2021-11-03 23:56:59,Nice work Danny Also grabbed ABNB U toward the lows Missed COIN and recently initiatives in the high 200s PLTR was a good one I grabbed at IPO and have added since,0.365,positive,2162303483,26,2,2,2021-11-04 07:37:23,
27,1456108376107196422,2021-11-03 23:57:44,When I was novice I made a lot of mistakes then I came to know about this C0mmunity prog pfe edu pbr aal nvda pltr hyg xela,0.0,neutral,1456107389342654470,0,1,0,2021-11-04 07:37:23,
43,1456109046315077633,2021-11-04 00:00:24,PLTR supported at 21EMA today will it be a change in behavior,0.0,neutral,1275460788635996160,236,1,1,2021-11-04 07:37:23,
7,1456110052364984321,2021-11-04 00:04:24,Great example of why social network maps like these are pseudoscience junk barely worth using as toilet paper Even if you do nothing but criticise a subject such as me criticising QAnon for 3 years straight you can be falsely depicted as supporting it,0.10925925925925924,positive,2868370994,,23,68,2021-11-04 07:37:23,
32,1456112399191355401,2021-11-04 00:13:43,cc to see what someone is thinking about remotely but please understand that Eye will be recruiting the DOJ amp FBI and launching an investigation into the very unsound and unethical hormonal torture and identity extortion and sociopathy,0.05,positive,399771334,79,0,0,2021-11-04 07:37:23,
34,1456112572223180804,2021-11-04 00:14:25,venture capital fund Genesis Partners Genesis Partners co invests alongside other leading venture capital firms and angel investors like Sequoia Capital Norwest Venture Partners Canaan Partners Accel Partners Benchmark Capital Greylock Partners Joe Lonsdale founder,-0.125,negative,1179464402791219206,743,0,0,2021-11-04 07:37:23,
18,1456117522357309453,2021-11-04 00:34:05,Cathie Wood cost basis in high 40 s after buying about 1mil shares over the last two days FWIW,0.08,positive,2165931456,,0,1,2021-11-04 07:37:23,
14,1456117695179599872,2021-11-04 00:34:46,Remember the final phase of a bull market can sometimes be the most violent upswing during that cycle Does that mean that s what s to come and the end is nigh Too soon to tell but worth noting if we go parabolic it s time to plan for an exit IMO,-0.06250000000000001,negative,102869127,,14,143,2021-11-04 07:37:23,
19,1456120485968678914,2021-11-04 00:45:51,Update PLTR Weekly PLTR at the apex of this pennant,0.0,neutral,1208467461521043456,17462,3,19,2021-11-04 07:37:23,
15,1456126075331768323,2021-11-04 01:08:04,I mean you basically called him a right wing secret agent advocating for crime when in fact you have a minor disagreement over the proper extent of state surveillance power so actually understandable,-0.07946428571428572,negative,3010775305,,0,0,2021-11-04 07:37:23,
13,1456128594363789312,2021-11-04 01:18:05,PLTR CHART it s starting to get tight Earnings Report is on 11 9 Keeping this on watch for a breakout either up or down,-0.11137566137566139,negative,1433638309260107776,2838,0,6,2021-11-04 07:37:23,
4,1456129127132459008,2021-11-04 01:20:12,Dude wants to hit the ground running,0.2,positive,24041126,,0,4,2021-11-04 07:37:23,
8,1456134990673195014,2021-11-04 01:43:30,Symbols mentioned in this article NVDA GOOGL FB AAPL MSFT NUAN AMAT AMZN NOW CRWD INTC QCOM PLTR AI IBM ACN ZI ZEN COUP BA HD DOCU NFLX ADBE BKR CRM SQ MTCH IAC TTD FIVN V MA PANW FTNT MU TER TGFTX,0.0,neutral,1093447620893331457,1959,1,0,2021-11-04 07:37:23,
3,1456135543494889475,2021-11-04 01:45:41,How many different stocks do you own Share deets in comments TSLA,0.3666666666666667,positive,31263848,,4,76,2021-11-04 07:37:23,
2,1456141424383102980,2021-11-04 02:09:04,When I was novice I made a lot of mistakes then I came to know about this C0mmunity prog pfe edu pbr aal nvda pltr hyg xela,0.0,neutral,1456141063731748866,0,1,0,2021-11-04 07:37:23,
39,1011632270359212032,2018-06-26 11:28:23,hero The CIA and Palantir singled out in 2010 2011 Glenn Greenwald as the weakest link in the Wikileaks inner circle FiveEyes Palantir came into existence as a result of Peter Thiel selling his company to Pierre Omidyar Glenn Greenwald s current boss,0.0,neutral,59241915,,18,26,2021-11-04 07:37:22,
41,1011940644334522369,2018-06-27 07:53:45,hero Inslaw Prosecutor s Management Information System PROMIS a software that has been modified several times even being used to by Isreal to backdoor telecom companies to intercept every communication and our own rogue government on 9 11 to backdoor the FAA controls,0.3,positive,266320223,,3,6,2021-11-04 07:37:22,
40,1173380367077847040,2019-09-15 19:37:34,1 man photog don Michelle net Here s the goose Tell me who owns it PROMIS PRISM PALANTIR PEGASUS Exposed NSA Surveillance 2019 Documentary Sway Guevara Mirror,0.0,neutral,266320223,,9,7,2021-11-04 07:37:22,
38,1436041714423287809,2021-09-09 14:59:59,Is the CDC the Centre for Disease Creation Their predictive capabilities suggest that this is most likely the case Dr Bryan Ardis has investigated this strange prediction of a new outbreak if disease among young US kids and uncovered interesting facts,0.19772727272727275,positive,867738228937416705,,44,62,2021-11-04 07:37:22,
23,1442597167185612804,2021-09-27 17:09:01,It s one thing to know that Peter Thiel espouses far right views it s another to see how he directly enables them to run free on Facebook Trump scandal Palantir rptdly taught CambridgeAnalytica who were funded by Mercer amp run by Bannon,0.22142857142857142,positive,115393565,,59,98,2021-11-04 07:37:22,
42,1447171375702151169,2021-10-10 08:05:17,Everyone knows Apple Amazon Microsoft But how do you find the next AFRM PLTR or USPT early Here are 9 GREAT resources for finding stock ideas 8 of them are FREE,0.325,positive,61558281,,818,3907,2021-11-04 07:37:22,
7,1455565995922370563,2021-11-02 12:02:31,Finally CrypTurtles Universe first giveaway event has come If you want a free CrypTurtle follow us join discord RT this tweet and Tag 3 friends with NFTgiveaway CrypTurtles and SolanaNFTs hashtags And dont forget to fill the form,0.21666666666666667,positive,1435331838638272512,,18,47,2021-11-04 07:37:22,
28,1455881370333589511,2021-11-03 08:55:42,BLACKSWAN,0.0,neutral,1288111940795998210,48,1,1,2021-11-04 07:37:22,
16,1455905658184912896,2021-11-03 10:32:12,8 Palantir Peloton is in my wife s account Roblox is in my boys account Palantir in my account Palantir specializes in big data analytics and does a lot of work with large defense and commercial institutions With clients like that I m in and expect to hold,0.07142857142857142,positive,965699949512900608,6064,1,10,2021-11-04 07:37:22,
9,1455914869056684036,2021-11-03 11:08:49,PLTR 2025 Boston Consulting Group McKinsey amp Company 1 000 2030 2000 foundry,0.0,neutral,1282707763282317315,,5,53,2021-11-04 07:37:22,
8,1455914911653974017,2021-11-03 11:08:59,Palantir 2025 1 2,0.0,neutral,1282707763282317315,,1,25,2021-11-04 07:37:22,
10,1455926390151389186,2021-11-03 11:54:35,Do you subscribe to ARK s original research Newsletters commentaries white papers and more right in your inbox Sign up here,0.2901785714285714,positive,2398137084,,28,425,2021-11-04 07:37:22,
15,1455974996048809987,2021-11-03 15:07:44,VLD,0.0,neutral,135584247,,0,0,2021-11-04 07:37:22,
37,1456019373261348865,2021-11-03 18:04:04,That is what I am assuming Unless RBC has info on another 164M contract But I doubt it,0.0,neutral,898532053,,0,0,2021-11-04 07:37:22,
31,1456029060098822149,2021-11-03 18:42:34,The journey began with Vote Leave breaking the law,0.0,neutral,121762421,,46,152,2021-11-04 07:37:22,
19,1456036274570252292,2021-11-03 19:11:14,Where did you read that,0.0,neutral,1408533989250551818,,0,0,2021-11-04 07:37:22,
0,1456060647595204608,2021-11-03 20:48:05,Why I Left the Left by Tulsi Gabbard By the time I lost the primary everyone other than Jimmy Dore and horny libertarians hated me So when Peter Thiel offered me a million dollars to become a Republican how could I say no,-0.125,negative,1258153337498865665,,53,871,2021-11-04 07:37:22,
30,1456095777667878914,2021-11-03 23:07:41,Just been trading sideways,0.0,neutral,419230916,,0,0,2021-11-04 07:37:22,
32,1456113393153167362,2021-11-04 00:17:40,Again PLTR will be one of the most important companies of this century,0.45,positive,1183572296440528896,,0,1,2021-11-04 07:37:22,
33,1456115832442875906,2021-11-04 00:27:22,Given all the news still there is no concern to get out of it as PLTR never moved on the news from contracts recently just the market volatility moved it during last two months I am holding it through thick and thin what I have now,-0.17500000000000002,negative,966120697,,0,2,2021-11-04 07:37:22,
35,1456123688080846853,2021-11-04 00:58:35,GOOGL,0.0,neutral,814893508066680832,,0,34,2021-11-04 07:37:22,
22,1456137350011043843,2021-11-04 01:52:52,Ticktoctick blocked me a while back It was over a tweet he misunderstood He mentioned an earthquake where he was and I said S A F Meaning San Andreas Fault My bad He s got an ego But very bright,0.0700000000000001,positive,562183479,,0,1,2021-11-04 07:37:22,
12,1456140330831519746,2021-11-04 02:04:43,Doesn t know where to put the bag,0.0,neutral,1055489858028822534,,0,1,2021-11-04 07:37:22,
34,1456148769284657156,2021-11-04 02:38:15,I said before that a weekly close above 27 is a big deal for PLTR,0.0,neutral,45850853,389,0,0,2021-11-04 07:37:22,
13,1456153943772434432,2021-11-04 02:58:48,The CDC s got a palantir seeing stone able to predict a coming epidemic of polio like disease in kids How They happen to set the vax schedule and only ONE jab is given in the fall the flu shot The CDC knows the un declared poisons adjuvants in the shot THAT S HOW,0.25,positive,4219475351,845,2,1,2021-11-04 07:37:22,
36,1456156877755142146,2021-11-04 03:10:28,It s crazy how I have claims to assets on PLTR by being a share holder Feels like I m leveraging success,-0.15,negative,1382340829235142658,40,0,0,2021-11-04 07:37:22,
25,1456163841956585472,2021-11-04 03:38:08,J ai presque jamais aim un joueur autant que j ai aim Torres entre son arriv e et la fin d ann e 2010 Mais son d part et les circonstances de celui ci m ont fait beaucoup trop mal pour lui pardonner,0.0,neutral,44080108,,1,6,2021-11-04 07:37:22,
26,1456164391838109699,2021-11-04 03:40:19,PLTR Another Abbvie Job posting to integrate CRM MDM Fusion Data lake on Palantir Foundry The conviction is getting stronger By the Looks of these job postings Abbvie is trying to integrate everything into an Ontology using Palantir Foundry,0.0,neutral,1299916382084063232,287,1,5,2021-11-04 07:37:22,
