,tweet_id,datetime,tweet_text,polarity,sentiment,author_id,followers_count,retweet_count,like_count,collection_time,original_tweet_id
7,1455675363175145477,2021-11-02 19:17:06,Hiding Place 2 3 3 tez Seeking a Shepherd 4 5 2 tez Summer Heights 9 10 1 tez Palant r 3 3 3 tez,0.0,neutral,1392780454181457920,,2,2,2021-11-04 07:37:36,
8,1455687897127002113,2021-11-02 20:06:54,time for PLTR puts,0.0,neutral,2530835306,16189,1,13,2021-11-04 07:37:36,
1,1455726485839429634,2021-11-02 22:40:14,How To Identify Mispriced Options To Make Millions TSLA MRNA AAPL FUBO GME AMC NIO PLTR LCID SPY QQQ DWAC WISH CLOV PLUG ES COIN,0.0,neutral,416749415,5443,1,1,2021-11-04 07:37:36,
21,1455860379289067525,2021-11-03 07:32:17,Yes tradable Roman Flagged on my end Multiple casino related stocks been setting up Here 2 more GDEN CZR MGM,0.16666666666666666,positive,176670699,,0,4,2021-11-04 07:37:36,
18,1455868502225588231,2021-11-03 08:04:34,BNGO BIG PR NEWS DROP Bionano Genomics Announces Major Updates to Its Solve and Access Data Solutions Adding Significant New Variant Detection Analysis and Reporting Capabilities for Optical Genome Mapping on the Saph,0.1434659090909091,positive,32901608,,13,84,2021-11-04 07:37:36,
13,1455873187112267780,2021-11-03 08:23:11,Yes it has changed me It has made me more angry and cynical yet I keep coming back,-0.15,negative,1421467824908816440,,0,0,2021-11-04 07:37:36,
24,1455882148792184836,2021-11-03 08:58:47,PLTR I still think she is primed for more upside key it can get over this 26 70 level of resistance with that we should see 27 If volume really kick in here a move over 27 14 27 20 we could possibly see the 29 level under 25 35 25 it could maybe go for a retest at the TL,0.175,positive,3098328494,977,0,0,2021-11-04 07:37:36,
19,1455882820472213506,2021-11-03 09:01:28,TSLA Twitter Sentiment on 2 Nov 2021 was Positive 39 0 Negative 15 7 Neutral 45 3,-0.03636363636363636,negative,1218312549973680128,,0,0,2021-11-04 07:37:36,
0,1455884833465454592,2021-11-03 09:09:27,Cathie Wood s sold 848k shares of PLTR yesterday,0.0,neutral,817007725666242561,146632,11,121,2021-11-04 07:37:36,
17,1455888677117247493,2021-11-03 09:24:44,WallStreetBets Top Stock Mentions Today WSB TSLA 358 GME 265 CAR 223 BBBY 215 OCGN 157 AMC 145 SPY 130 BB 115 CHGG 55 ATVI 50 SAVA 43 AMD 43 NVDA 35 CRSR 31 LCID 31 FB 29 PLTR 29 DWAC 22 CLOV 20 MSFT 19,0.5,positive,963625727752114176,4874,2,5,2021-11-04 07:37:36,
16,1455889350621908995,2021-11-03 09:27:24,think memes go PARA soon and WISH goes MULTI but hey what do i know GME AMC BB BBBY NAKD PLTR,0.0,neutral,1277420106973356039,1035,1,4,2021-11-04 07:37:36,
10,1455890458580762627,2021-11-03 09:31:49,Inc Car telematics is more than just fair pricing and CO2 monitoring In fact we devoted most of our time to building a first of its kind claims and emergency services experience,0.51,positive,11695352,,14,129,2021-11-04 07:37:36,
11,1455890584078520337,2021-11-03 09:32:19,latest pod joins to talk and what he sees in the future for connected vehicle data why WeJo is poised for growth and partnerships with the likes of PLTR VOSO WeJo shareholder vote is 11 16 wherever you get pods,0.25,positive,1042058485435965447,1404,2,10,2021-11-04 07:37:36,
4,1455891270321065989,2021-11-03 09:35:02,TSLA 2000 BTC bitcoin NEW ATH BREAKOUT IMMINENT TESLA WILL break record gains never before seen stock stocks stockmarket StockMarketindia china baba Pltr nio baba chgg anet t lcid pdd bac zg bngo htzz nio artl amd bbd itub pbr btbt x fubo,0.13636363636363635,positive,1430872959195836417,139,0,0,2021-11-04 07:37:36,
6,1455895061925879817,2021-11-03 09:50:06,Learn to trade and make money both ways,0.0,neutral,2530835306,16189,0,3,2021-11-04 07:37:36,
5,1455895222802690051,2021-11-03 09:50:44,M riel lingered in the dark until she felt safe that none of the king s men were following her The dark woods gave her safety as she strode back to her hideout The cut on her arm was still bleeding but nothing she couldn t handle It was a small price to pay At least she,-0.049999999999999996,negative,1450044654309855232,92,0,0,2021-11-04 07:37:36,
6,1275305851524390914,2020-06-23 01:53:03,FACT You nailed Thiel s Palantir Technology s conflicts now look at NSO Group,0.0,neutral,1002617783652438022,,2,2,2021-11-04 07:37:34,
29,1447563551875297284,2021-10-11 10:03:39,Under Project Nightingale Google worked with Ascension to gain access to patient records from 1 000s of hospitals in 21 states Doctors and patients were not notified that Google employees were given access to their data gt,0.0,neutral,300616187,,1,0,2021-11-04 07:37:34,
0,1455599112850710534,2021-11-02 14:14:06,Big Tech are great villains in the rise of dark forces over the last 20 months,0.1625,positive,49445813,,5,20,2021-11-04 07:37:34,
18,1455611538539118593,2021-11-02 15:03:29,PLTR 1H vs primary pattern levels No close below today so far after claiming the other day and failing 26 82,0.125,positive,17014671,1790,0,0,2021-11-04 07:37:34,
1,1455612741448880134,2021-11-02 15:08:16,PLTR 26 CALL 11 5 40 SWING PLTR,0.0,neutral,1279187403857702913,1040,1,6,2021-11-04 07:37:34,
11,1455621624586199045,2021-11-02 15:43:34,TODAYS Recap CAR calls paid over 2 500 NVDA calls paid over 150 MARA calls paid 130 and still going COIN Calls paid over 65 SI Calls paid over 60 SPY Calls paid over 30 SPY TSLA SHOP AMZN ROKU NFLX BYND LCID PLTR COIN HOOD MARA,0.0,neutral,341223258,,6,34,2021-11-04 07:37:34,
17,1455709763828912132,2021-11-02 21:33:48,Interesting selling Tesla,0.5,positive,1425613921,,0,0,2021-11-04 07:37:34,
25,1455735150940196867,2021-11-02 23:14:40,If only there was something Dems could do to shore up their popularity,0.0,neutral,1634248890,,6046,41969,2021-11-04 07:37:34,
3,1455856754294669320,2021-11-03 07:17:53,PLTR MIND BLOWING Lol,0.8,positive,1356214197009457157,,6,119,2021-11-04 07:37:34,
31,1455897117818560515,2021-11-03 09:58:16,LC since 44s yesterday dip buy sofi 21s extra swing afrm 149s yesterday drop cnd yesterday under 12 alert only loser i have today pltr but that okay i can wait,0.16666666666666666,positive,279020836,7050,1,3,2021-11-04 07:37:34,
30,1455897704677232644,2021-11-03 10:00:36,AI 10k nothing but bulls out today 50 strikes for December and January with all the volume,0.0,neutral,1353048914815971328,,0,16,2021-11-04 07:37:34,
28,1455897726160306182,2021-11-03 10:00:41,OCGN straight to hell,0.2,positive,1405178686916075520,,0,7,2021-11-04 07:37:34,
32,1455897978254807058,2021-11-03 10:01:41,We have identified an unusual PLTR sweep that expires on November 19 2021 with a strike price of 23 00 11 001 PUT contracts with a price of 0 49 Above Ask were purchased at a 545 838 premium,0.1,positive,1254906887490936845,,1,0,2021-11-04 07:37:34,
19,1455898963803058185,2021-11-03 10:05:36,cnd slow and steady sbea again floor 10 so almost no risk left afrm making me pltr loaded more low 25s let see,0.07333333333333332,positive,279020836,7050,0,6,2021-11-04 07:37:34,
26,1455899410806677511,2021-11-03 10:07:23,Closed off position on sofi ipof next,-0.05,negative,71748831,761,0,1,2021-11-04 07:37:34,
27,1455900325915729922,2021-11-03 10:11:01,Okay I ll stop,0.5,positive,1405178686916075520,,0,5,2021-11-04 07:37:34,
4,1455901244690735105,2021-11-03 10:14:40,Tesla vehicles are being added to Uber s scheme to accelerate electrification of its London fleet electrek TSLA UBER,0.0,neutral,2704294333,,62,653,2021-11-04 07:37:34,
24,1455901584530026497,2021-11-03 10:16:01,pltr nice reversal wants green,0.20000000000000004,positive,1450622593082482689,4,0,1,2021-11-04 07:37:34,
23,1455903829166379017,2021-11-03 10:24:56,With my son s current portfolio allocation below it has an expected return of 144 and a Sharpe ratio of 1 58 GBTC 56 PLTR 34 ARKQ 6 TWTR 4,-0.05,negative,1666206925,433,0,0,2021-11-04 07:37:34,
20,1455903833394188293,2021-11-03 10:24:57,To prove this if I adjust the solver to maximize expected return it recommends 100 allocation to PLTR This gave me a 175 expect return with a Sharpe ratio of 0 98,-0.1,negative,1666206925,433,0,0,2021-11-04 07:37:34,
21,1455903832211398664,2021-11-03 10:24:57,I think portfolio optimization this way is a useful tool for sure Definitely gives me some insight But I would still like to have PLTR in the portfolio and this wants to get rid of it completely Having PLTR provides a little more risk but more return,0.2390625,positive,1666206925,433,0,0,2021-11-04 07:37:34,
22,1455903830927986693,2021-11-03 10:24:57,After doing a Markowitz portfolio optimization my recommended portfolio should be ARKQ 56 GBTC 33 TWTR 11 PLTR 0 This portfolio gives me an expected return of 76 with a Sharpe ratio of 1 83,-0.1,negative,1666206925,433,0,0,2021-11-04 07:37:34,
15,1455904837313384452,2021-11-03 10:28:57,Just published Mid Week Insight blog Multitude of ideas relating to our current market environment Give it a read amp let me know thoughts If helpful please share with buddies ES F NQ F STOCKS BA TSLA NFLX FB AAPL WISH PLTR BABA NVDA,0.0,neutral,1276260743252447235,77,0,0,2021-11-04 07:37:34,
16,1455905656595173381,2021-11-03 10:32:12,7 Roblox If you have children you get it Roblox is an obsession with most children from 7 to 13 When I say obsession it s ludicrous how much they talk about this game They always ask how much Robux do you have Time will tell No additional investment is expected,0.07999999999999999,positive,965699949512900608,6064,4,25,2021-11-04 07:37:34,
2,1455909560275767302,2021-11-03 10:47:43,1 PLTR contract renewal The purpose of this bilateral modification is to 1 Exercise Option Year 1 of 2 2 Change of COR 3 Change Key Personnel All other terms and conditions remain unchanged and in full force and effect,0.075,positive,898532053,1436,4,43,2021-11-04 07:37:34,
7,1455910234506022912,2021-11-03 10:50:24,Stonks are currently in easy mode,0.43333333333333335,positive,906234475604037637,,7,235,2021-11-04 07:37:34,
5,1455910901723406343,2021-11-03 10:53:03,Just saw the news of Andela s Series E again and I m curious what s the highest number of rounds a company has raised Anybody gotten to Series Z,-0.1,negative,48685848,30650,0,0,2021-11-04 07:37:34,
12,1401903103473979396,2021-06-07 10:05:20,AMC TSLA PLTR COIN NKLA profit locked and walking have a great day,0.8,positive,18349074,80932,15,42,2021-11-04 07:37:33,
17,1454081122619383816,2021-10-29 09:42:09,QuantumScape Third Party Battery Test Results Disclosure I m long QS,-0.025,negative,1033127171298975744,,25,313,2021-11-04 07:37:33,
21,1454347200822194179,2021-10-30 03:19:27,PLTR If you can t access Vimeo here s Palantir Energy Film Talk about kickass marketing Part 1,0.0,neutral,1356214197009457157,,50,272,2021-11-04 07:37:33,
26,1454872238914682881,2021-10-31 14:05:46,373 s WATCHLIST 11 1 21 SNAP TSLA CVM MRAI PLTR FDX OCGN AAPL SPY ALL CHARTS DD BELOW Thread It s time to outplay everyone,0.0,neutral,3365643792,242,0,1,2021-11-04 07:37:33,
11,1455618027991539714,2021-11-02 15:29:16,I agree,0.0,neutral,1909387362,84,0,0,2021-11-04 07:37:33,
2,1455709007398809606,2021-11-02 21:30:47,erickbrandon gracias llisto here are some of my october photos at check out and,0.0,neutral,1380896147745644545,850,4,14,2021-11-04 07:37:33,
13,1455817482699083777,2021-11-03 04:41:50,I feel like I can t keep up with PLTR They have my head spinning Love it,0.5,positive,2314674194,,1,3,2021-11-04 07:37:33,
25,1455891957696368640,2021-11-03 09:37:46,Which stocks in your portfolio are you most excited about,0.4375,positive,972704750,,15,108,2021-11-04 07:37:33,
31,1455905006742224896,2021-11-03 10:29:37,QS Strength on this I hear,0.0,neutral,1054561163843751936,,7,100,2021-11-04 07:37:33,
15,1455912513606934535,2021-11-03 10:59:27,PLTR broke above the 200MA of this holds them it should start to run,0.0,neutral,1423667112560766983,,0,4,2021-11-04 07:37:33,
29,1455914687871266817,2021-11-03 11:08:05,Buying BKKT because is goin to run Let s gooooo NOV 19 75 calls AFRM PLTR NVDA AMD ROKU SNAP CRM FB AAPL UPST MRNA QS U TSLA DATS ES TWTR DKNG ZM APPS BB CEI FFTY SQ WISH DLO SPX AMZN TTD PTON NFLX AMC OSTK ATER SIVB AAL ATKR,0.0,neutral,1269460308130705408,116,1,2,2021-11-04 07:37:33,
28,1455915272364335105,2021-11-03 11:10:25,Come hell or high water I am going to class pill this man,0.16,positive,2433526788,,4,419,2021-11-04 07:37:33,
24,1455916488427192326,2021-11-03 11:15:15,So Cathie taking a loss on pltr,0.0,neutral,216221852,1911,0,1,2021-11-04 07:37:33,
20,1455920812742127622,2021-11-03 11:32:26,ARE YOU SMILING Given to you for FREE OSTK up 155 consolidating UAL up 40 and going CCL up 17 consolidating If you made money If you want more SPY TSLA SHOP AMZN ROKU NFLX BYND LCID PLTR COIN MRNA QCOM ROKU NIO,0.45,positive,341223258,3884,2,21,2021-11-04 07:37:33,
22,1455921397524467722,2021-11-03 11:34:45,ARKW dumped a boat load of PLTR and I d love to know why Maybe they know something,0.5,positive,1295125041001172992,7733,0,8,2021-11-04 07:37:33,
10,1455922010547265542,2021-11-03 11:37:11,Ark sold another 850k shares of PLTR I am concerned,0.0,neutral,1351722827628634115,23,0,0,2021-11-04 07:37:33,
19,1455923054643752960,2021-11-03 11:41:20,Trades I m new so I say this just throwing it out there for I know not the reason but didn t she shed some Tesla too Tesla is rising a lot so that was prob the reason and palantir has stalled around this price for a year now and maybe she knows it s coming one more time b4 moon,0.3181818181818182,positive,464459622,70,0,2,2021-11-04 07:37:33,
16,1455924109397876743,2021-11-03 11:45:32,With the coming forth of the technocratic world order the most important use case is going to be privacy Bitcoin and most coins are not private at all They are track and trace coins They will try to bring forth a social credit system tied to digital wallets and CBDC s 1 2,0.2388888888888889,positive,2209106522,17435,6,17,2021-11-04 07:37:33,
14,1455924324213403661,2021-11-03 11:46:23,The same WEF banksters that run the USA run China Russia etc just look at the New Belt and Road and smart cities like Neom They want to see any account that has more than 600 in it and they have Palantir and other surveillance systems in place 2 3,0.14512987012987014,positive,2209106522,17435,3,10,2021-11-04 07:37:33,
7,1455929608612810757,2021-11-03 12:07:23,PLTR IONS still a buy,0.0,neutral,180561603,12101,0,1,2021-11-04 07:37:33,
3,1455929846803189769,2021-11-03 12:08:20,Because they trimmed 2 of their position for rebalancing If you re concerned then sell I ll buy your shares PLTR,0.0,neutral,1374129841646272515,189,0,1,2021-11-04 07:37:33,
6,1455933136269807619,2021-11-03 12:21:24,FWBI soon to breakout you don t want to miss out This is easily a 10 stock PAYTIENCE METX FAMI CEI FCEL BBIG AMC GME LCID MRAI MOGO GLG OCGN SHIB PLTR,0.43333333333333335,positive,1453210493187809281,8,3,3,2021-11-04 07:37:33,
0,1455935776533909512,2021-11-03 12:31:53,erickbrandon Thanks for the tag Josh Here are four recent shots Hiding Place 2 3 Morning Crawler 3 3 Don t Walk the Line 3 3 Palant r 3 3 I ll tag,0.1,positive,1392780454181457920,1073,3,8,2021-11-04 07:37:33,
30,1455871909522989060,2021-11-03 08:18:06,I m being sarcastic I own an enormous amount of PLTR,0.2333333333333333,positive,1426663707682160648,,0,2,2021-11-04 07:37:32,
13,1455885338052812816,2021-11-03 09:11:28,I tweet stormed for 3 years straight about the threat of GOP s propaganda machine as in the highly coordinated discourse control amp architecture of FB digital news Fox PR because it mattered Hope you can see now what we re up against,0.065,positive,536904693,,1060,3936,2021-11-04 07:37:32,
29,1455917281138167809,2021-11-03 11:18:24,I love it when your favourite shares are on sale Loading up on FVRR at a cheaper price than it was a year ago,0.5,positive,121248904,,0,15,2021-11-04 07:37:32,
26,1455922760803303426,2021-11-03 11:40:10,sofi pltr lcid upst afrm Lets be on the same page I am dip buyers after heavy DD and i love swing it and taking profit after i took profit i find other stock and move on I dont like to married any stock unless it is AAPL Not even TSLA GL,0.08499999999999999,positive,279020836,7050,1,8,2021-11-04 07:37:32,
35,1455926162669010946,2021-11-03 11:53:41,pltr nice bounce off trendline,0.6,positive,1126196458699481088,,1,2,2021-11-04 07:37:32,
33,1455927376215433217,2021-11-03 11:58:30,Z ZG As long as this stays below the 75 94 pivot it is going no where,-0.05,negative,1232525106003365890,,0,11,2021-11-04 07:37:32,
28,1455938492001918979,2021-11-03 12:42:41,yeah This deploying ASR things with GPOs and cryptic strings of text you paste in is a nightmare for SMBs automate that stuff and you will get genuine takeup Many not all of the ASR rules can be enabled with almost no risk of negative impact enable those,0.20000000000000004,positive,19767495,,0,1,2021-11-04 07:37:32,
24,1455941946900459529,2021-11-03 12:56:24,00 The best FOI request is the one you already know the answer to,1.0,positive,1238051417497186304,,0,1,2021-11-04 07:37:32,
15,1455942223082700804,2021-11-03 12:57:30,PLTR a potentially overstated deal in public data could lead to a disappointing Q3 Analysts might have uncovered an error in the public data which caused a deal to be overstated by 163M Post adjustment Q2 Federal deal volume would be down 28 Y Y,-0.1511111111111111,negative,1160594389036670978,2088,1,6,2021-11-04 07:37:32,
7,1455942499503984645,2021-11-03 12:58:36,Zillow now at 66 with an excellent proven business millions of customer and ZIP code data is now half that of PLTR or a SHIB a meme dog,0.4166666666666667,positive,345525945,86530,6,110,2021-11-04 07:37:32,
23,1455942548355223555,2021-11-03 12:58:48,Most mentioned stocks on WallStreetBets over the 24 hours 1 GameStop GME 2 Tesla TSLA 3 Bed Bath amp Beyond BBBY 4 Ocugen OCGN 5 AMC 6 Blackberry BB 7 Activision ATVI 8 Chegg CHGG 9 SAVA 10 Facebook FB 11 WISH 12 SOFI 13 AMD 14 Palantir PLTR Source,0.5,positive,1250830691824283648,126247,1,17,2021-11-04 07:37:32,
18,1455942720829022209,2021-11-03 12:59:29,Update names I m currently involved PLTR ABNB AAPL PLUG AMD DKNG BKSY NIO CLF new addition PSFE added Today Z Risk reversal 65p 11 05 21 exp 80c 1 21 22,0.06818181818181818,positive,807161508635365377,878,2,5,2021-11-04 07:37:32,
21,1455944775387975681,2021-11-03 13:07:39,Hard to believe but I use Milton Friedman amp put trust in shareholders to make a case for AIethics and AIauditing I also argue that the fact that Palantir relocated to Switzerland might say something about AIethics awareness here with,-0.2916666666666667,negative,966263603576889345,7194,4,8,2021-11-04 07:37:32,
11,1455944781062889478,2021-11-03 13:07:40,and and Organized and moderated by Org Check it out,0.0,neutral,966263603576889345,7194,0,2,2021-11-04 07:37:32,
22,1455945203295170565,2021-11-03 13:09:21,Intraday Option Volumes TSLA 885k 59 call 41 put AMC 706k 81 call 19 put AMD 430k 81 call 19 put AAPL 413k 73 call 27 put F 366k 78 call 22 put BBBY 340k 72 call 28 put LCID 327k 77 call 23 put Z 287k 40 call 60 put,0.0,neutral,817007725666242561,146632,10,36,2021-11-04 07:37:32,
20,1455945207934070795,2021-11-03 13:09:22,GME 272k 82 call 18 put BB 266k 95 call 5 put NVDA 254k 72 call 28 put UBER 237k 85 call 15 put PLTR 228k 67 call 33 put OCGN 225k 76 call 24 put HOOD 216k 81 call 19 put AAL 212k 81 call 19 put ATVI 203k 67 call 33 put,0.0,neutral,817007725666242561,146632,1,15,2021-11-04 07:37:32,
16,1455945512041922563,2021-11-03 13:10:34,BARK 10P rolled Nov19th to Dec17th 1 1 Paid me a net credit to roll 11 Worst CSP trade of the year SELLING options premium 45DTE SPY QQQ TSLA PLTR SOFI RBLX AFRM NVDA BTC SQ LCID Options trading stocks dividend,-0.5,negative,739575120671346688,1330,1,3,2021-11-04 07:37:32,
19,1455946818685112330,2021-11-03 13:15:46,To have the husband of lecturing us about justice and accountability is twisting up my guts If that family has shares in Serco Palantir Faculty AI or Capita they d better have them well hidden,0.16666666666666669,positive,1193799875705688064,846,1,2,2021-11-04 07:37:32,
6,1455947648507072512,2021-11-03 13:19:04,FWBI holding for the big move looks like it wants to breakout to 4 first then METX CEI AMC SHIB OCGN SNDL ADXS LCID FUBO PLTR ONTX MOGO MRAI,0.15,positive,1453210493187809281,8,1,1,2021-11-04 07:37:32,
3,1455948078100398080,2021-11-03 13:20:46,Recap of positions open SKLZ SNAP NKLA GEVO REKR FUBO PLTR TTD GREE BB FSLY OPEN AAL OCGN WY GPS Portfolio performance 72 all time stamped,0.0,neutral,1166020930054889472,2196,2,2,2021-11-04 07:37:32,
14,1455948216336203781,2021-11-03 13:21:19,BreakingNews OTC FOMC FOMO ANNOUNCES STRONG ADVISORY BOARD APPOINTMENTS CORP bbd open penn fsr opti sos srne any btbt mvis nio bbig fubo amc coin pltr wkhs riot dkng,0.21666666666666665,positive,1389095384614506496,314,1,0,2021-11-04 07:37:32,
2,1455949316216918019,2021-11-03 13:25:41,The problem is that they hit 40s amp 170s respectively during last February s euphoria Now people think they re duds due to that late price anchoring Still optimistic on these two long term have smaller positions in each,-0.07916666666666666,negative,85663573,61327,1,29,2021-11-04 07:37:32,
9,1455949518663520257,2021-11-03 13:26:30,Starting with 7k down to 3k back up to 29k Lot of thanks to this chat TEVA UAA PLTR HIVE WIMI NVDA T XELA FB,0.011111111111111106,positive,1455949249791803399,0,1,0,2021-11-04 07:37:32,
12,1455949739221045250,2021-11-03 13:27:22,COP26,0.0,neutral,19608199,,4,38,2021-11-04 07:37:32,
8,1455951605619060737,2021-11-03 13:34:47,When I was novice I made a lot of mistakes then I came to know about this C0mmunity PLTR CCIV NIO NVDA TWTR AMC GME SNAP,0.0,neutral,1439965173314322438,55,1,0,2021-11-04 07:37:32,
4,1455952162639335427,2021-11-03 13:37:00,Wtf are your comparisons Palantir and Shib,-0.5,negative,1281084926540935168,2360,0,1,2021-11-04 07:37:32,
0,1455953654654148611,2021-11-03 13:42:56,A lot of research amp product development right now is driven by what s profitable not what s useful But often co s uses public research amp subsidies as a hoping off point Point is we already paid the cost thru tax dollars but don t get either the gains or a say in direction,0.1952380952380952,positive,14997519,2552,0,5,2021-11-04 07:37:32,
1,1455953676019847172,2021-11-03 13:43:01,PLTR What is the most frustrating thing about working for Palantir We feel you buddy,0.04999999999999999,positive,1356214197009457157,1638,17,95,2021-11-04 07:37:32,
1,1438252394622631943,2021-09-15 17:24:26,IF YOU ARE NEW TO OPTIONS STOP BUYING THEM BLINDLY 9 TIMES OUT OF 10 YOU WILL LOSE MONEY USE TO CALCULATE FUTURE PRICE OF THE OPTIONS THIS IS THE BEST FREE TOOL OUT THERE LIKE AND RETWEET SO OTHERS CAN LEARN TOO,0.20727272727272728,positive,109813243,,305,1211,2021-11-04 07:37:30,
27,1454636362481614852,2021-10-30 22:28:29,PLUG Block Deals FCEL Block Deals PLTR Block Deals LCID Block Deals F Block Deals SNDL Block Deals,0.0,neutral,1398562566603898882,,10,7,2021-11-04 07:37:30,
10,1455596285549895686,2021-11-02 14:02:52,This is a trash story Other firms like Clearview Palantir have scraped this data from Facebook and can and will continue to do so What FB does here is irrelevant and just a bid to manufacture a positive story out of nothing,-0.13257575757575757,negative,4848301,,1,1,2021-11-04 07:37:30,
14,1455626280829915136,2021-11-02 16:02:04,Small gains add up amp nobody can convince me otherwise Quit going for homeruns in this market 3 837 78 on the day amp 5 446 04 on the week so far Trades today Wins AAPL PTON NIO AFRM AAPL PLTR Loss PFE AAPL,0.049999999999999996,positive,1369752877707767808,,2,74,2021-11-04 07:37:30,
17,1455671067414958082,2021-11-02 19:00:02,We re a global leader in our space backed by leaders in their respective areas incl amp Why Because they believe in our vision to use DataForGood amp to make mobility cleaner safer amp more efficient Find out more wejourney MSFT PLTR GM,0.25,positive,2863741665,4145,2,5,2021-11-04 07:37:30,
7,1455920946124976131,2021-11-03 11:32:57,In the last 2 5 years my whole portfolio multiplied 450 But it wasn t always like that I used to only buy cheap stocks Things changed after I learnt how to find and hold Multi baggers Here s my top 9 tweets on finding 10 100 baggers and holding them Enjoy,0.25,positive,1262980001005056001,,481,1952,2021-11-04 07:37:30,
13,1455944582730977285,2021-11-03 13:06:53,daddy Operation Warp Speed started under Trump and will continue when he comes back,0.0,neutral,1417603619944235008,,0,2,2021-11-04 07:37:30,
23,1455946509023842304,2021-11-03 13:14:32,true that just sucks trying to onboard homies and they gotta wait 5 days,0.024999999999999994,positive,1332099101115224067,,0,1,2021-11-04 07:37:30,
12,1455949315197652995,2021-11-03 13:25:41,Two stocks that people throw shade at often but have actually performed quite well if you got in early PLTR direct listing was at 10 last September now sitting at 25 LMND IPO d at 50 last summer now sitting above 72,0.03333333333333333,positive,85663573,,1,54,2021-11-04 07:37:30,
28,1455954007789391876,2021-11-03 13:44:20,Z now down nearly 25 on the day Ouch,-0.02777777777777779,negative,817007725666242561,,5,92,2021-11-04 07:37:30,
26,1455955576442130433,2021-11-03 13:50:34,We cover other areas of Day Trading so check out content below As always thanks for watching AMC SNAP SNDL GME BA SQ GE PLTR PLUG CCTV,0.037500000000000006,positive,1082726807919415296,459,1,1,2021-11-04 07:37:30,
21,1455957950841769984,2021-11-03 14:00:00,It was great to sit down with for their latest podcast episode to chat about all things Wejo We covered our use of our DataForGood products to drive the AV and EV revolutions our upcoming combination with VOSO and our partnerships with PLTR amp MSFT,0.3814814814814815,positive,2863741665,4145,1,3,2021-11-04 07:37:30,
